{
  "schema": "mba.robin.release-manifest.v1",
  "project": "PRL Wallet",
  "version": "1.103.3566",
  "build": "3566",
  "built_at": "2026-06-23T07:26:28-04:00",
  "content_updated_at": "2026-06-23",
  "release_status": "tester",
  "working_status": "not-yet-first-confirmed-working-wallet",
  "public_channel_label": "Tester APK",
  "testing_warning": "This build is published so the website, release manifest, downloads, checksums, and Android install path can be tested. It is not yet confirmed as the first fully working wallet release. Do not use it for meaningful funds.",
  "copy": {
    "eyebrow": "Direct Android tester APK",
    "hero_title": "Pearl Wallet for Android is being tested.",
    "hero_summary": "PRL Wallet is a noncustodial Android wallet project for Pearl. This page is wired to release metadata so every build can update the version, date, download link, hash, changelog, and status without editing the homepage.",
    "primary_cta": "Download tester APK",
    "secondary_cta": "Verify the hash first",
    "above_fold_note": "Release data is populated from JSON now and XML as fallback. CI/manual builds emit both."
  },
  "source": {
    "repository": "https://github.com/Robin-s-AI-World/pearl-wallet-android",
    "commit": "9922c25e5aef7613b1f5b0cbad3eca47af1bfa5f",
    "branch": "master",
    "ci_system": "manual",
    "ci_run_url": null
  },
  "distribution": {
    "channel": "direct-apk",
    "google_play_status": "not-active",
    "canonical_origin": "local-nginx-ui",
    "canonical_live_root": "/var/www/prldroid-wallet/current",
    "canonical_domain": "https://prldroid-wallet.robin.mba/",
    "shared_hosting_mirror": "downstream mirror for higher public traffic, not the canonical release authority"
  },
  "artifacts": [
    {
      "id": "android-aab",
      "platform": "android",
      "kind": "aab",
      "filename": "pearl-wallet-android-v1.103.3566-release-signed.aab",
      "size_bytes": 56370049,
      "sha256": "f079d173784ff1ddda694d5803af652a1c627905716a0f69792356eda0bb55bc",
      "locations": [
        {
          "type": "web",
          "public": true,
          "url": "downloads/pearl-wallet-android-v1.103.3566-release-signed.aab"
        }
      ]
    },
    {
      "id": "android-apk-release",
      "platform": "android",
      "kind": "apk",
      "filename": "pearl-wallet-android-v1.103.3566-release-signed.apk",
      "size_bytes": 108231429,
      "sha256": "9b2a42942ba21dea49ff0a3e88df9c85cfa1c95e6e34a224ff22be87238f7b7d",
      "locations": [
        {
          "type": "web",
          "public": true,
          "url": "downloads/pearl-wallet-android-v1.103.3566-release-signed.apk"
        }
      ]
    },
    {
      "id": "android-debug-symbols",
      "platform": "android",
      "kind": "native-debug-symbols",
      "filename": "pearl-wallet-android-v1.103.3566-native-debug-symbols.zip",
      "size_bytes": 45867536,
      "sha256": "32e345981f3c14613a6dc71b9938b971052431573dbe070076b7dcde4eed8995",
      "locations": [
        {
          "type": "web",
          "public": true,
          "url": "downloads/pearl-wallet-android-v1.103.3566-native-debug-symbols.zip"
        }
      ]
    }
  ],
  "verification": {
    "primary_artifact_id": "android-apk-release",
    "sha256_command": "sha256sum pearl-wallet-android-v1.103.3566-release-signed.apk",
    "expected_sha256": "9b2a42942ba21dea49ff0a3e88df9c85cfa1c95e6e34a224ff22be87238f7b7d"
  },
  "features": [
    {
      "title": "Manifest-driven landing page",
      "status": "available",
      "summary": "The homepage reads release metadata at runtime and fills version, dates, download URLs, hashes, status, features, and changelog."
    },
    {
      "title": "Direct signed APK distribution",
      "status": "available",
      "summary": "The tester APK is distributed from the site while app-store distribution is not active."
    },
    {
      "title": "Checksum verification",
      "status": "available",
      "summary": "The published SHA-256 is displayed beside the APK download so testers can confirm file integrity before installing."
    },
    {
      "title": "SPV wallet recovery",
      "status": "being-verified",
      "summary": "Import recovery, genesis birthday handling, and full balance discovery are under active repair and verification."
    },
    {
      "title": "Explorer preliminary balance",
      "status": "being-verified",
      "summary": "The app can display a provisional explorer balance for the visible receive address while local sync catches up. Full HD-wallet discovery remains a separate verification concern."
    },
    {
      "title": "Local canonical deployment",
      "status": "available",
      "summary": "The local nginx-ui deployment is the canonical site. Shared hosting can mirror it later for traffic, but the local release root remains authoritative."
    }
  ],
  "known_limitations": [
    "Working status: not-yet-first-confirmed-working-wallet",
    "Do not use tester APKs for meaningful funds unless a release is explicitly marked production-ready.",
    "Explorer preliminary balance is single-address and provisional until local wallet recovery is complete.",
    "Manual builds and CI builds must emit this manifest shape; index.html must not be hand-edited for release data."
  ],
  "changelog": {
    "entries": [
      {
        "version": "1.103.3566",
        "date": "2026-06-23T07:26:28-04:00",
        "notes": [
          "See commit log for details.",
          "Release builds are signed with the same production key; in-place upgrades work. If switching from a debug/dev build, uninstall first."
        ]
      }
    ]
  }
}
